{
  "$schema": "https://decantr.ai/schemas/mutation-pack.v1.json",
  "packVersion": "1.0.0",
  "packType": "mutation",
  "objective": "Execute the add-page workflow against the compiled app contract.",
  "target": {
    "platform": "web",
    "framework": "react",
    "runtime": "spa",
    "adapter": "react-vite"
  },
  "preset": null,
  "scope": {
    "appId": "app",
    "pageIds": [
      "home",
      "login",
      "account-step",
      "profile-step",
      "interests-step",
      "discover",
      "matches",
      "chat-list",
      "chat-thread",
      "profile-own",
      "profile-other",
      "settings"
    ],
    "patternIds": [
      "hero-split",
      "cta-section",
      "features",
      "how-it-works",
      "testimonials",
      "footer",
      "auth-form",
      "onboarding-wizard",
      "content-uploader",
      "form",
      "chip-multiselect",
      "filter-bar",
      "spatial-card-stack",
      "swipe-action-bar",
      "match-celebration",
      "hero",
      "bottom-tab-bar",
      "presence-avatars",
      "stats-bar",
      "avatar-grid-tile",
      "conversation-list",
      "chat-header",
      "chat-thread",
      "chat-input",
      "mobile-profile-hero",
      "tech-pills",
      "settings-nav"
    ]
  },
  "requiredSetup": [
    "Treat the compiled topology as the source of truth until the essence changes.",
    "Refresh Decantr context after structural mutations so downstream tasks read current packs."
  ],
  "allowedVocabulary": [
    "add-page",
    "top-nav-footer",
    "swipecircle",
    "light",
    "marketing",
    "seo",
    "conversion",
    "demo-mode",
    "auth",
    "mfa",
    "oauth",
    "email-verification",
    "password-reset",
    "photo-upload",
    "step-validation",
    "form-validation",
    "interests-picker",
    "swipe-deck",
    "matches",
    "match-celebration",
    "chat",
    "profile",
    "filter-bar",
    "tab-navigation",
    "empty-states",
    "keyboard-shortcuts",
    "theme-toggle",
    "hero-split",
    "cta-section",
    "features",
    "how-it-works",
    "testimonials",
    "footer",
    "auth-form",
    "onboarding-wizard",
    "content-uploader",
    "form",
    "chip-multiselect",
    "spatial-card-stack",
    "swipe-action-bar",
    "hero",
    "bottom-tab-bar",
    "presence-avatars",
    "stats-bar",
    "avatar-grid-tile",
    "conversation-list",
    "chat-header",
    "chat-thread",
    "chat-input",
    "mobile-profile-hero",
    "tech-pills",
    "settings-nav"
  ],
  "examples": [],
  "antiPatterns": [],
  "successChecks": [
    {
      "id": "mutation-essence-first",
      "label": "New pages are declared in the essence before any code generation begins.",
      "severity": "error"
    },
    {
      "id": "mutation-shell-contract",
      "label": "New routes inherit an existing shell and section contract unless the essence changes first.",
      "severity": "error"
    },
    {
      "id": "mutation-refresh",
      "label": "Refresh compiled packs after the mutation so downstream tasks read current topology.",
      "severity": "warn"
    }
  ],
  "tokenBudget": {
    "target": 1400,
    "max": 2200,
    "strategy": [
      "Prefer route summaries over repeated prose.",
      "Use compact vocabulary lists instead of large reference tables.",
      "Include only task-relevant examples and checks."
    ]
  },
  "data": {
    "mutationType": "add-page",
    "shell": "top-nav-footer",
    "theme": {
      "id": "swipecircle",
      "mode": "light",
      "shape": "pill"
    },
    "routing": "history",
    "features": [
      "marketing",
      "seo",
      "conversion",
      "demo-mode",
      "auth",
      "mfa",
      "oauth",
      "email-verification",
      "password-reset",
      "photo-upload",
      "step-validation",
      "form-validation",
      "interests-picker",
      "swipe-deck",
      "matches",
      "match-celebration",
      "chat",
      "profile",
      "filter-bar",
      "tab-navigation",
      "empty-states",
      "keyboard-shortcuts",
      "theme-toggle"
    ],
    "routes": [
      {
        "pageId": "home",
        "sectionId": "marketing-swipecircle",
        "path": "/",
        "patternIds": [
          "hero-split",
          "cta-section",
          "features",
          "how-it-works",
          "testimonials",
          "footer"
        ],
        "shell": "top-nav-footer"
      },
      {
        "pageId": "login",
        "sectionId": "auth-full",
        "path": "/login",
        "patternIds": [
          "auth-form"
        ],
        "shell": "centered"
      },
      {
        "pageId": "account-step",
        "sectionId": "onboarding-wizard",
        "path": "/signup",
        "patternIds": [
          "onboarding-wizard",
          "auth-form",
          "cta-section"
        ],
        "shell": "centered"
      },
      {
        "pageId": "profile-step",
        "sectionId": "onboarding-wizard",
        "path": "/onboarding/profile",
        "patternIds": [
          "onboarding-wizard",
          "content-uploader",
          "form",
          "cta-section"
        ],
        "shell": "centered"
      },
      {
        "pageId": "interests-step",
        "sectionId": "onboarding-wizard",
        "path": "/onboarding/interests",
        "patternIds": [
          "onboarding-wizard",
          "chip-multiselect",
          "cta-section"
        ],
        "shell": "centered"
      },
      {
        "pageId": "discover",
        "sectionId": "swipe-feed",
        "path": "/discover",
        "patternIds": [
          "filter-bar",
          "spatial-card-stack",
          "swipe-action-bar",
          "match-celebration",
          "hero",
          "bottom-tab-bar"
        ],
        "shell": "mobile-tab-bar"
      },
      {
        "pageId": "matches",
        "sectionId": "swipe-feed",
        "path": "/matches",
        "patternIds": [
          "presence-avatars",
          "stats-bar",
          "avatar-grid-tile",
          "hero",
          "bottom-tab-bar"
        ],
        "shell": "mobile-tab-bar"
      },
      {
        "pageId": "chat-list",
        "sectionId": "swipe-feed",
        "path": "/chat",
        "patternIds": [
          "conversation-list",
          "hero",
          "bottom-tab-bar"
        ],
        "shell": "mobile-tab-bar"
      },
      {
        "pageId": "chat-thread",
        "sectionId": "swipe-feed",
        "path": "/chat/:userId",
        "patternIds": [
          "chat-header",
          "chat-thread",
          "chat-input",
          "bottom-tab-bar"
        ],
        "shell": "mobile-tab-bar"
      },
      {
        "pageId": "profile-own",
        "sectionId": "swipe-feed",
        "path": "/me",
        "patternIds": [
          "mobile-profile-hero",
          "stats-bar",
          "tech-pills",
          "settings-nav",
          "bottom-tab-bar"
        ],
        "shell": "mobile-tab-bar"
      },
      {
        "pageId": "profile-other",
        "sectionId": "swipe-feed",
        "path": "/u/:userId",
        "patternIds": [
          "mobile-profile-hero",
          "stats-bar",
          "tech-pills",
          "bottom-tab-bar"
        ],
        "shell": "mobile-tab-bar"
      },
      {
        "pageId": "settings",
        "sectionId": "swipe-feed",
        "path": "/settings",
        "patternIds": [
          "settings-nav",
          "form",
          "bottom-tab-bar"
        ],
        "shell": "mobile-tab-bar"
      }
    ],
    "workflow": [
      "Declare the new page in the essence before generating code.",
      "Refresh Decantr context so section and page packs include the new route.",
      "Read the relevant section pack and new page pack before implementation."
    ]
  },